{
  "id": "T-KNIFE-001-UNITY",
  "title": "Integrate KNIFE_001 into Unity",
  "goal": "Import KNIFE_001 and prove the prefab, renderer, material, scale, and collider integration are valid.",
  "kind": "unity",
  "dependencies": ["T-KNIFE-001-BLENDER"],
  "maxAttempts": 3,
  "acceptanceCriteria": [
    {
      "id": "A01",
      "description": "The asset is imported and a validation prefab has the expected integration state.",
      "requiredEvidence": ["asset-report"]
    }
  ],
  "execution": {
    "steps": [
      {
        "id": "import",
        "adapter": "unity",
        "action": "import_asset",
        "criterionId": "A01",
        "evidenceType": "asset-report",
        "input": { "assetId": "KNIFE_001" }
      },
      {
        "id": "prefab",
        "adapter": "unity",
        "action": "inspect_prefab",
        "criterionId": "A01",
        "evidenceType": "asset-report",
        "input": { "assetId": "KNIFE_001" }
      }
    ]
  }
}
